{
  "id": "tc-abcdefgh",
  "name": "new",
  "display_name": "new",
  "marker": null,
  "marker_text": null,
  "labels": [
    "kind=review"
  ],
  "placement": "default",
  "session": "termctl",
  "pane_id": "%3",
  "window_id": "@2",
  "socket_path": "/tmp/tmux-1000/default",
  "created": "2026-10-30T12:00:00.000Z",
  "pid": 4242,
  "state": "running",
  "exit_status": null,
  "exit_signal": null,
  "keep_on_exit": "never",
  "changed": true,
  "display_updated": true,
  "dry_run": true
}
